date,review,rating,isEdited,title,userName,developerResponse
2021-03-16 13:42:06,"I have always loved learning about other cultures and how people live their everyday lives. Hornet’s Feed section, until recently, has been a way to get a glimpse of this especially in Asia, Russia, and South America.  That part is wonderful.   The last 3 months or so I get 3 or 4 stings a day from OBVIOUS fakes generated by Hornet.  I guess they think we are stupid. Over 3500 follows on a profile that was created today?  

Posting in my feed about this results in the post disappearing.  Replying to this profile with the question results in the message disappearing... 

Image search on google usually finds the profile pictures belong to someone on Instagram or similar.. 

Hornet has gone bad and the way they are doing it is SO OBVIOUS that I question why.  What do they stand to gain, unless the app itself is malicious?  I’m sad because browsing the Feed section has become my morning cup of tea activity, but I am seeing a sharp drop in activity there so by by hornet.",3,False,"Social media fun, spam bad",NoStoppin,
2020-01-12 05:33:07,"A nice idea though I don’t see the need to categorize the chats as they are. The main problem are the fakes; at best they waste time, but at worst they’ll scam you out of money and potentially your identity. I don’t know if that’s really possible, but I’m sure lots of folks enable location tags on pics and I know one’s email is linked to many apps, including bank apps. Even if that isn’t a problem, Hornet needs to do more. If I, a user, can find where the same photo has been used in three profiles, then surely a tech company can do the same- and I’ve reported quite a few profiles. I have a photo storage app that automatically identifies and collates pictures of people; why does Hornet do that? I’ve been chatted up by no fewer than FIFTEEN fake scammers in one week. Hornet does offer nice advice on instant protestations of love and “too good to be true” issues, and boy do these fakes deliver there. Military, on a mission but coming home soon, maybe a dog or two... strange though, that a guy supposedly born and raised in the states can’t type in English. It’s more than just grammatically poor, it’s absolutely incomprehensible. Hornet needs to find a way to weed these out somehow. I’ll be deleting my account soon, but I’ve started having fun messing with the fakers’ minds a bit. If all I can find are fakes, I don’t need it.",2,False,FAKE PROFILES,bksrmt,
2019-08-05 21:59:51,"Lot of fake profiles on these “LGBTQ+” social networking apps. I just recently uncovered a profile on this app using my friend’s photos. It was definitely not my friend and he confirmed it. Of course the fake user was making political discourse... I really think these “LGBTQ+” social apps might be an attempt to make identity politics out to be more popular than it truly is. I used to be more progressive minded, as were a number of my friends, but when you see most real LGBTQ+ people in person are nothing like on these “LGBTQ+” social networks (whom the media doesn’t seem to publicize as much as they do the “elites”), you realize there’s something off about the ebb and flow of these internet social networks. But then this is just for cyberloafer people without real jobs that moreso waste their time online. This is where the propaganda for identity politics flows. In my own experience, I think the discrete political movement to try to propagate our LGBTQ+ community are falling apart, which is good. Their little elite failure groups only have the Internet. All the rest of us are live in person and not buying it. If this wasn’t true, then these app developers would fix the spam problem, but obviously they could care less, and We the LGBTQ+ People are aware of all the fake internet posers.",1,False,Spammy app,Lavender X,
2020-01-12 02:02:24,"I’ve been on this site for a few years.  But all of sudden in the past two months pretty much everyone who is approaching me are scammers.  It starts with photos from attractive 20somethings, and leads to asking you to go Google Hangouts so chat is taken off this site. So far it is always someone from Africa/Togo to be clear, impersonating someone in the US Military.  Several times it has led to asking me to send them a phone as theirs isn’t working well, but they seem to be communicating fine from their phone, to claims they are in Afghanistan and have an ulcer from the food on Base and are looking for help funding their off-Base restraint bill.   In all cases it was easy to see the unsophisticated deception as the person on the other end isn’t really talking proper English.  Their texts are often off grammar, miss basic Americanisms that anyone would easily type. One of these was Bradley Davidson another today was Kokey Wagner....I’ve blocked them but for what I can see this site is 100% fake people and as they aren’t monitoring this may be helping scammers to take advantage of you.",1,False,Scammer Site/Don’t Download/Don’t Join This Sote,Hugalex,
2018-10-20 14:20:08,"Seriously ranks among the worst gay “social” apps ... only download this if you want your in-box to be constantly hit with messages from bots advertising other websites and apps ... oh, and the paid advertising messages too.

Tragic and horrible and a waste of time - the developers clearly have no filters in place to detect fake / spam accounts and asking users to police accounts for them is a joke ... after flagging 25 profiles and deleting / blocking spam messages, now I’m barraged with messages from the “moderator” thanking me for reporting and that they’ve identified the problem and fixing it.

Too late! This morning’s latest onslaught of spam messages - deleting my profile and uninstalling! Wish I could give less than 1 star - DON’T WASTE YOUR TIME WITH HORNET ... guess I’ll stick with the original, old school Grind’r",1,False,Among the Worst Gay “Social” Apps,Rick Boeker,"{'id': 5651306, 'body': 'We are sorry about the spam messages on Hornet. Fixing the problem is our top priority and we are working around the clock to fix it.', 'modified': '2018-10-24T22:50:40Z'}"
2022-03-01 10:14:23,"Used to be awesome for meeting people nearby, but sadly now loaded with scam artists from a few foreign countries, who have no idea how conspicuous they are. Still good for eye candy. Not giving up on other types of candy, either, but all the ""joined yesterday and now messaging you from 7 thousand miles away to tell you how badly I want an LTR"" guys are a bit too much. They are the ones with commercial modeling promotional pictures from twenty years ago, who think posing in front of luxury items makes them seem somehow more legitimate.",3,False,Sadly loaded with scam artists,World's Foremost Expert,
2018-10-14 20:28:41,"Lately the only messages I’ve been getting are from people somewhere past 7,000 miles away that want me to “find them” on another site. Or they are in the military in Africa but will be home soon. Or offering to put a decal on my car for $400 a week with a fake cashiers check. Or wanting to exchange sex for money. Anyone I’ve messaged does not respond, and the ones that have need money or a place to stay. This used to be a decent app. Now not so much. I’m about to delete this app because of the spam. Just like 99% is spam. And it seems to be more that I report it. Oh that’s it the developer is being paid to allow the spamming and the reported profiles are tagged with who reported it and they get the most spam. I get it now! Shady shady af",1,False,Spam bots galore,MacsRule43,
2020-06-14 21:21:16,"Hornet is an awesome app. It by far leads in features, ease of use and safety.

When a user signs-up, they get to set up their profile with multiple photos and a cool feature where you can have up to 4 private photos that you can enable/disable within the messages. I also love the consent of the hornet badge. 

This app reminds me of if Instagram and Grindr had a baby and named it hornet. It combines location based profiles with versions filters similar to grindr but also has the ability to search usernames, hashtags, as well as create posts and follow users. 

I also love that hornet is constantly working to create a great community where users get rewarded a hornet badge when they are authentic. This is a great concept to help removing bots and and bad people. 

Thanks hornet ! 🏳️‍🌈 💚 💛 💜  🖤 🤍",5,False,Best LGBT dating app I’ve used.,trevor knowlton,
2019-05-30 20:54:15,"After 5+ years of using the app I decided to delete my account and the app. There is nothing but spam on the actual app. Most of my notifications in a day were just spam bots reaching out and the developers do nothing to stop this, despite what they say in review feedback. This has been a problem for years and there has never been a noticeable difference.

Aside from that, the amount of advertisements from hornet and other businesses is out of control. Advertising is expected, but it shouldn’t be in my inbox. The amount of advertising is too much and is the main reason for me deleting this horrible app. They’re all about money opposed to listening to the people who use their app.",1,False,Awful,jace757,
2019-05-19 22:47:22,"I bought this iPhone from a friend and this app was blocked for his account, I 've sent several messages tô te developers and they ask for information of my friends account that I don't have It. It was his account that blocked this phone and I bought this phone without knowing that this app was blocked for his. I do not have anything to do with what my friend did. I Just bought an iPhone that was blocked because of him.",5,False,They blocked even If you pay for the app,daniel.ricardo,
2017-11-14 23:08:19,So as we know many of these apps are created by gay men. The set up their rules and standards. Grindr is another like this. So you have probably some gay dude who only allows what he thinks as hot and sexy to post full body in only underwear showing but if someone who isn’t ripped who does a full body in underwear they violate the rules. I went through and sound countless sexually explicit photos for public view. Also so note these explicit photos were of really hot guys. Well I guess that the biz if you want to attract guys to your app you need to put the meat out there. Hornet your no different than Grindr. Whoever is approving the profiles and photos is probably jerking off to the hot guys and denying the average guy to post similar pics.,1,False,Never fair,Neo King Serenity,
2018-07-13 15:11:28,It seems that my profile attracts people from Africa and the Caribbean who seem to have no money and wish me to open bank accounts and other items to help them in their quest to gain their inheritance even had one guy state that he was in the Air Force and Afghanistan and got a large reward for helping a sultan save his family then he pulled the trick Of trying to have me give some person $5520 just to get his Reward back to the United States Think there are lots of scammers on the site so beware,2,False,Lots of guys too far away,Balleng6,
2022-11-02 16:04:18,"This app is home to over a million chatbots. If you have the patience to get through them, there are scores of foreigners on the hunt for American husbands. The app also cannot decide whether it is social media or connections; you have a primary inbox and then some other inbox and either can have messages you may or may not know about but as you check them you are greeted with an ad every other message. This could be why the chatbots are deployed. Rather pathetic and if you expect it to deliver 😜 other ways 😜 the path through drivel is a loooooong road to ho.",1,False,"Bots, Bots and $ hunt",wadesterk,
2018-09-01 00:49:43,"Here a Bot, There a Bot, Everywhere a Bot, Bot!  

Update 2018:  My buddy and I have a bet. Will you help settle it?  I say that 75 % of the guys on here are fake. Cat fishing. Robots. 

He says it’s at least 85%. Which is it?  Or is it higher?  

If I were to go off of the contacts I get, it’d be 100%. Can’t you fix that?  I have better luck with Sister Betty Bower’s Prayer Phone List!!!  SAD!

———————

A year ago, this site was much better. I decided to stay on the other night and was contacted by almost 20 men!  Yeah!  Except they were all from overseas, most “serving in Army” and wanted me to join them on KIK or Google or Text. Of course, that is when they get your info and start sending links to spam you and ask for money. None ... NONE were legitimate people. None ... NONE were local people. All ... ALL were fake (stolen) profiles. Yes, they were THAT obvious and they all followed the same pattern. 

Fix this and you’ll be a good site again.",1,False,"Here a Bot, There a Bot, Everywhere a Bot, Bot!",Guten Morgan,
2022-02-05 15:36:41,"On a post about how the Wachowski Brothers became the Wachowski sisters I left a comment outlining all the reasons why they are setting a bad example for others and why going through gender reassignment is a bad idea, for example the suicide rate is 20 times higher among those who have gotten gender reassignment versus those who haven't, but the Hornet community doesn't care about having an open discussion, they don't care about freedom of speech. For them if you don't fall in line with the talking points of the Democratic party, no matter how insane they are, you should be silenced.",1,False,Run by close-minded liberals,Johnathandjvisonfvuonfevunfe,
2020-01-05 17:18:55,"I’ve been on this app for about a month.  I have to say more than 75% of people reaching out to me are fake profiles.  When I ask them where there from I have gotten the exact response each time.  “I’m on a Peace keeping mission overseas and will be back in the states soon”.   You can almost here there accent in the way they write, and don’t forget about the really bad spelling.  Had one guy say he was from “Texas, Houston”. When I corrected him, he told me I was incorrect.  I emailed the editor of this app and explained the recurring problem, he responded with BYE!  This app is a joke, don’t waste your time...",1,False,Lots of fake profiles.,Haskell54,
2018-12-24 15:43:15,"Could be so much better. Needs a few changes to really compete with other apps:
-ability to delete recently sent pics (you should be able to curate these so one off photos can be eliminated)
-the ability to paste in text is crucial if you’re translating and yet has not worked since the last few updates. WHY?! Bring it back.
-built in translator would be stellar and nobody is doing it (could be huge selling point)
-blocking mechanism is slow (figure out how to make it faster)
-search doesn’t refresh automatically as it should
-there seem to be way too many clicks to do something and then even to go back - someone should try to improve user experience by decreasing clicks needed for any action
-I’ve got tons of ideas. Feel free to reach out if you’d like help. Applied for beta testing but haven’t heard anything.",1,False,Needs serious improvement,DJJD1023,
2018-04-26 05:32:35,"The app randomly suspended my account for “public pictures breaking the guidelines”... 
My profile does NOT break any rules of this app I NEVER EVER EVER send nudes or publicly post nudes. All my pictures are of me and they are 100% CLEAN from the waist up ALWAYS, or pictures from my personal life with either my best friend or CLEAN AND FRIENDLY social media posts. They have absolutely no reason to suspend my account, I’ve never ever violated any terms!!!! If you read this... Please give me back my account!!!! 
NONE OF THE PICTURES ON MY PROFILE BREAK THE TERMS OF THE APP AND NONE KF MY PICTURES BREAK THE GUIDELINES!!!",1,True,If I could give 0 Stars I would here’s why,XxFemmyFoxX YouTuber,"{'id': 3258223, 'body': 'Hi! Thank you for your feedback. Please contact us at feedback@hornet.com for further investigation.', 'modified': '2018-04-26T05:32:35Z'}"
2022-03-17 03:19:32,"I recently installed this app and was going to sign up for premium but I decided to check the reviews first and judging by the overwhelming negativity and the lack of responses to these claims about this app I will not only not be going premium but I will be deleting this app as soon as I am finished writing this, some of these issues seem pretty severe I suggest that you address and seriously work on resolving them because I see I am not the first and doubt I am the last that will be scared away by this",1,False,Bad reviews scared me off,RavenHale,
2018-11-18 17:34:32,"This app needs to be reformed and updated. It’s been so hard to sign up and to login to that I quit using this app altogether. 

I would love to see this app to be more intuitive to use, and not ask me about my outside social media, because I don’t know what you’re doing with my information. 

Also Hornet app should no longer requires you to have a Facebook account in order to enable it, So many people have left Facebook. As among many others issues I and the majority of my friends have with this app.",1,False,This app needs a better update,Suiew1977,
2018-01-18 15:52:51,"The app itself is fine, and I used to use it quite regularly. Recently, however, spam (fake profiles asking you to visit a website) is out of control. I've turned off notifications because of it; please work on a filter to get back to how good the app used to be.",3,False,Spam is out of control,milotunes,
2018-04-20 13:28:14,"So many fake profile and yet the developers are not interested in putting more security to get ride of them, all you need to do is type and email address and pass and boom! You are in.
Also i have no idea who is monitoring the photos, i guess its computer generated because i put photo with cloth on and it says it has violated the rules and deleted my photos, seriously guys, work on your app for pit sakes, or maybe its another fake Chinese company ...",2,False,Fake profiles,Ssalehi85,
2018-03-06 23:29:52,This app has more fake profiles than real ones and the app owners don’t even try to keep the scammers out. Almost every single guy so far since I’ve been on this app has been a fake. Always says they are close but then they say they are in the military over seas and will be back in a month.  Yeah right. They need to start banning these apps until they start monitoring the profiles for fakes.  Thanks for allowing yet another loser to create a profile and waste another month of my time.,1,False,Terrible app. Full of fakes.,Andrey12,
2022-03-14 12:51:09,"Guy! Please join us to the big LGBTQ campaign to boycott this abusive app, the way this app treats its members is just very abusive by bombarding very annoying ads that pops up every 15 seconds!!! Ot is offensive and abusive approach to use its members as just a tool to monetize the app and not any dignity! 
The campaign is supported by great LGBTQ celebrities allies on March 28th.
The further info will be announced and get viral soon by our great celebrities allies! 
Time to stand for our right and not becoming just a tool on their hand! 
Cheers",1,False,Please join us to boycott this app,Awaken !!!,
2018-11-11 03:42:50,"For me the last thing I want to do is pay for a gay dating app! This app is great because it’s free for the basic version. If you want more options then you’ll simply have to subscribe. I think it’s a great way to have more people using this app, Thanks hornet team!",5,False,Great app,Siri reference,
2020-08-06 06:56:13,While using the app including their media partners asks your consent for cookies. But when you delete Hornet app from your phone using the settings menu your profile and cookies stay on your phone. There is no way to delete them. When you login with a fresh app install all your tracking data cOmes back live and the app doesnt even ask for your password to login. Your privacy pays the bills.,1,False,Your privacy oays the bills.,Makia.US,"{'id': 17149254, 'body': 'The issue you describe is not a Hornet app fault or Hornet privacy issue. It is a known issue on iOS devices. A quick internet search will explain how you can remove data from your device, after you have uninstalled an app. Rather than go through that procedure however, If you wish to completely remove all data, then it can be easily done through the Hornet app. Go into your profile, then Settings, then Account, then choose Delete Account. This will fully and permanently remove the data. You can also write to us at feedback@hornet.com and we will do it for you. ', 'modified': '2020-08-07T18:29:04Z'}"
2022-10-17 18:09:28,"Used this app for years, but few latest updates completely broke it. It lags, it freezes, it’s not loading properly and most of all - it drains battery like no app on my phone. 
I like the community but the experience is completely ruined by these latest changes. 
And though developers say they fix issues with latest updates - well, it still has it, so no fix yet",1,False,Unusable,Vespos3000,
2022-10-02 18:47:58,"After the last update or two, Hornet has been less responsive and more prone to crashing. It freezes at times while typing a response in chat. Also does not appear popular in my area. I live in a metro area and everyone with 100 miles of me fits on less than a full page. Perhaps it’s more popular in Europe.",2,False,Recent updates are buggy,LanceInMN,
2022-03-13 17:25:08,"Hornet’s ads run about 3 times as long as G’s, but the app isn’t three times better. It’s actually quicker to close the app and start over. 
Plus they have this strange way of dividing chats into Primary and requests and new ones are easy to miss.  It’s like the IT guys are justifying their jobs by creating that worthless feature. 
Hornet: you’re not going be a player if your game is at this level.",1,False,Constant Long Ads / Needlessly Complicated,mc4asia,
2021-02-18 14:48:23,"As an old hornet user, the app was better two yrs ago, but it getting worse and worse day by day! Unfortunately, Hornet became a good place for showing nudity and prostitution! as the Lgbt community members, every time I open the app I feel uncomfortable and disgust!
It becomes a good place for showing
body Private parts and nudes!
Is it a dating app or anatomy photo albums ?!
I wonder why Hornet never do something to solve this problem permanently ?!",1,False,Absolute disgusting,Razaelo,
2017-10-31 12:48:31,"I signed up, used my primary email address. The app was ok, but I didn’t really find the value in it. So I deleted the app.

But now I keep getting emails! I have clicked the unsubscribe button at least 5 different times and each time I’m told I’ve successfully unsubscribed. But then a week or two later, I get another email!

The app is ok, but DO NOT sign up using your primary email address, create one specifically for spam first!",1,False,Do not sign up with a legit email!,IamWJC,
2022-04-30 22:35:16,"Thanks for the site, wish we could open the option of only seeing top or bottom sections as filter without charge.",5,False,Good for socializing,BENVNU,
2018-12-31 23:00:29,"This app is plain awful.  You look at the app, thinking you have 6 new messages, and then open it up only to find it’s six different advertisements in your inbox, from various Hornet partners, but including Hornet as well.  If you like being inundated with SPAM, then this app is definitely for you.  Hornet says they’re working on this “problem,” but it only gets worse, it seems.  Garbage app!  Find something better.",1,False,Awful App - Nothing But Adverts,JasonAsher,
2020-02-04 08:11:52,This app and service have fallen far. Create a fresh account on competing apps. What hornet shows is vastly different from the others. Nothing but fake profiles. Some of these are female. The grammar and spelling errors give it away. The last time I used hornet was over two years ago. They’ve divided the inbox during that time. What for? I used the app for all of a day and was ready to uninstall. Nothing could convince me to stay in it’s current state.,1,False,Yikes,Chase Babb,
2018-04-17 03:02:13,"I know this would be very difficult to control, but every single person that contacted me via the app has been a “catfish” situation. Everyone is at least 6000 plus miles away and has a hot picture. (Most harvested from the internet)When in conversation I am ask for money or cell phone and even a car! So sad that we can’t have a legit dating app... 😱",2,False,Great idea.... but,Descriptions not truthfull,
2022-11-30 06:52:47,"This app is not very good period one or two clicks to get an ad pop-up that takes 20 seconds need to click twice again period so I would suggest you look for a different app period to sit here and spend the Maritime I am trying to talk to nobody and then there’s nobody around my area is pointless so I have deleted the app I will say goodbye 

go to Grindr or go to a gay barb you’ll have better results",1,False,Horrible  gay app,john 1221122222,
2020-02-11 05:16:29,"There are bunch of fake accounts and scammers on this app! Been receiving their messages every 30 minutes which was annoying! I received a few messages who are local however those pictures weren’t real. It is impossible to find someone from this app. Hornet, you MUST take this action seriously and clean up the mess this caused!",1,False,*READ!* you have been warned!,TysonLove7,
