date,review,rating,isEdited,title,userName,developerResponse
2013-05-22 15:33:04,"Much better than Grindr. Added everything Grindr needed. However, app is very laggy and very slow. Can't even load my chats or people half the time.",2,False,Awesome but so slow,iChaseH,
2013-03-29 21:46:57,Easy to navigate and like the private pics area,5,False,Great app,mrmikey1224,
2014-07-28 04:51:51,It's very well developed.. U can search thru regions and the filter is quite effective,4,False,Better than Grindr,nikolakezic,
2013-03-17 20:29:51,Great to see a even easier and nicer UI than other competitors.,5,False,Love it,Typical_day,
2013-02-19 00:40:22,I like the scroll pics feature of this app.,5,False,Nice app,Rylosevelt,
2012-12-13 17:00:20,This update is soo faster that I like exploring new guys even more ;-),5,False,Super fast!,Daniel Piterak,
2012-02-06 09:51:13,Should get more attention,5,False,Great app,Aboysown,
2016-04-03 13:40:30,"The app won't let me log back in to my account after I deleted it. Tried resending a password change to my email but nothing would be sent. Very bummed out, please fix this.",1,False,Needs fixing asap,skullboy051797,
2015-11-06 22:00:07,"u can meet a nice people and have date with them 
essay to chat 😍👍",5,False,Amazing App,Unautid arab emarits,
2014-10-20 14:46:45,App has some cool features that grindr does not.,5,False,One up,SingingSongbird,
2014-09-01 21:39:12,"You didn't list that in your change log of ""new features"" prior to updating.  

I don't like.   But don't see the value of paying for the option of having the ads removed.  Ugh.",1,False,Ads. Really?,jat1285,
2013-07-03 22:30:09,Like multi-pic feature a lot! Could be more informative.,4,False,Picture This,Seab67,
2013-10-18 22:58:05,"I have never seen an app with such a furious pace of pop up full screen ads. Every few seconds? Really? How much bandwidth do all these video ads use anyway? Hornet has become in useable.

The price point for a subscription is too high, IMHO.",1,False,How to wreck an app,Liberalsin,
2013-09-12 09:29:16,"Seemed to have a lot of potential at first, but too few users and buggy - can't even get it to load now.",2,False,Missed it by this much,Grimmypoo,
2013-04-19 19:21:14,The app runs pretty good so far as I can see. At least you can find hotties in the same state,4,False,Great app !,JeremyThurman2013,
2013-06-11 03:16:08,NO SUPPORT. Doesn't work very often. Seems a lot of people have switch and Hornet wasn't prepared. Great features but no support if you have an issue combined with it not able to handle the traffic I'd say wait a while.,1,False,Could be great,Thad Pence,
2013-05-01 15:44:26,"This app is awesome, more features And so much better than grindr!",5,False,Amazing app!,Dudeitsjoey ,
2013-04-03 14:48:54,I lve this app.. Multiple pics and classier guys!! More efficient way of meeting new people!,5,False,Love it,Randytiggs,
2012-04-20 16:13:16,Would be better in a bigger city.,4,False,Not bad at all!,tyrshaw,
2013-01-17 05:49:13,Suddenly started crashing when opening chats,3,False,Was fine but..,zuzuuzuz,
2012-10-15 04:22:57,I absolutely love this app!  It blows Grindr out of the water!,5,False,WAY better than Grindr,Ninja in Oregon,
2012-05-22 00:50:28,"The app continually sends a pop up asking for a rating, as many of these applications do. For that annoyance alone, I lower my ratings. For all apps! Get rid of this nonsense if you want a better rating.",2,False,Pop up annoyance,mike-soba,
2014-04-26 19:23:34,Works a lot better than grindr and has a broader range of individuals.,4,False,Convenient,Cruikshank9378,
2012-03-02 15:16:15,.,5,False,Better than Grindr,Boy_Dactyl,
2013-10-01 02:52:58,"Ever since the update, my chats have been disappearing.  Sometimes right in the middle of the chat.  Now I can't find the people I was talking to.",2,False,Needs to work out the bugs,Shootingnathan,
2013-08-28 16:40:19,"Very slow, its always loading and it charges fakes app badges from viewed Messages. Maybe it could improve if Messages and profiles pictures will be saved as cache in devices.",1,False,Slow,iKa1ser,
2013-06-07 07:07:57,Better than grnder,5,False,It works better than grnder,WonderNonoSF,
2013-06-03 06:20:38,What the he|| is with these random audio clips for something coming from if they aren't stopped I'm going to delete because audio I don't want is a data hog and I won't tolerate it,2,False,Nice app,Markie Mark 1982,
2013-05-16 14:07:33,So far the most easy to use out there,5,False,Love it,NACHO'S MUSIC,
2013-04-01 21:40:43,"I love this app and would give it 5 stars but keep getting told that the servers have been ""stung."" And it won't let me do anything.",3,False,Slow!!!,tonibear817,
2013-01-30 15:47:33,Better than most apps like it,5,False,Love,Shayne0821,
2012-04-29 00:23:51,Better features than Grindr.  Just need more guys to use it.  Get the word out!,5,False,Best gay app,InkedDaddy,
2017-08-15 21:51:11,"Love it! Meeting individuals, and actually being talked with by people that are close.",5,False,Really great,Dignbones60,
2015-12-09 00:16:17,Although many are shallow. It's a great app none the less.,5,False,Nice app,AngelAM1993,
2014-11-12 19:22:53,"Hornet is the best app in its class. Better interaction, more stable than grindr.",5,False,Hornet is better,Keith SFO,
2014-06-25 01:17:50,A better app since the update. The biggest problem is some of the ppl.,3,False,Good but could be better,Markus PHX,
2014-01-27 13:43:39,Nice app but I'm having problems with it right now,5,False,Love it,aiglazie,
2014-01-22 01:52:13,This is a cool app. My only issue is that I get 2 message notifications but there's only 1 message when I check. Pls fix it is extremely annoying.,2,False,I like,3ksandasong,
2013-04-08 07:01:26,At least Grindr has competition.,4,False,Decent,robertoryan,
2012-05-14 22:26:10,"This app overpowers Grindr in so many ways, could use a few touch ups here and there but overall; Great App.",4,False,"Awesome App, Stylish Design",Brandon Adams,
2013-04-04 14:54:26,"Better than the rest out there 
Lots of guys!",5,False,Good app,AlejandroG81,
2013-12-03 06:24:40,Better than grindr and is actually easy to use. Thumbs up!,4,False,Hornet,AlanR17,
2012-05-02 04:37:35,This app and Jackd are far better than Grindr.,5,False,Better than best,Dfwtx76,
2012-03-09 15:54:01,Very well organized. Possibly the best,5,False,Surprised!,Mddawgwan,
2012-02-20 21:04:38,Nice to see who is around your area,5,False,Great app,CustosStellae,
2012-02-10 23:18:57,This app needs to get it together when it comes to location. Shows me nothing but people NOT near me. Everyone is several hundred to to thousands of miles away.,1,False,Ugh!,PatrickPatrick,
2011-11-14 08:58:14,"I love the app I met some great people on this app but it's buggy
Really bad 
I have trouble viewing messages and there is always two copies of each profile showing up 
And profile picture settings needs help I can put pictures in but the Icon seems to be jacked up Plz check

But the app is lovely nice UI",3,False,Can improve a lot,zizone,
2017-03-27 13:05:23,So far it doesn't seem to be working like before and now the location is completely off it says I'm in a completely different town when I'm not,1,False,It need a huge fix,Smash lover 92,"{'id': 86997, 'body': 'We are aware of the problem and are working to resolve it as soon as possible. We apologies for the inconveniences this has caused. Your comments help us make this app better!\n\nHave a nice day!', 'modified': '2017-04-04T20:07:02Z'}"
2015-09-28 21:34:27,"Sophisticated app , all the options that u can't have on apps such Grindr.",5,False,👌🏻👌🏻,Nass00351,
2013-12-20 10:14:16,When it works like it should it's a good app.,3,False,Overall good but still needs improvements,Slbenton18,
2013-06-02 19:19:39,It's a less dramatic version of Grindr but so slow and very buggy. Needs an update ASAP.,3,False,Good but extremely slow,Go2NRG,
2013-10-17 07:47:35,"This update introduces full-screen ads every 5-10 swipes, which was not stated in the what's new. They clearly did not test those as they break the search interface and leave the app unusable prior to starting a new search. 

Lame!",1,False,DO NOT UPDATE!!!,raised by bears,
2013-05-10 13:55:09,This is much better than Grindr. Still has some growing to do to be really great but they are on their way.,3,False,Much Better than Grinr,Naes 11,
2013-05-28 09:47:22,Amazing app and features,5,False,Better than grindr!!!!,Mnsch101001100,
2013-05-09 20:19:17,Better gay app than the others!!!,5,False,New favorite,ryryeverett,
2013-04-14 00:54:37,Really enjoy the explorer option,5,False,Great stuff,Jetta797,
2013-04-07 16:40:24,So far so good. Love that you can explore on other areas. Best social app for gay men.,5,False,Ditch Grindr. Here's the better app,Porman_Ph,
2013-02-24 05:11:36,This app is the best app ever..... At first but after a while I go to get on the app. And it won't load. All I see is how many messages I have and the main screen. No matter what I try I can not get on the app.,2,False,FAILURE,Steve-0_0,
2013-05-14 17:28:09,Over all it's better then you know,4,False,I'm content!!,jusalovr,
2012-09-05 19:36:10,Excelent app!!! I've already made many friends!!!,5,False,Wonderful app!!!!,cmontenegro,
2012-04-17 15:56:46,You guys should fix the message section.. It's weird!,3,False,Messages,Dvusdave,
2017-03-02 02:44:08,Except for the doughy guys and doesn't charge to send messages,5,False,Pretty cool,Jarizi,
2015-10-18 09:07:49,"Beware! Don't waste your time.  Site is filled with fake profiles, people that ""work"" several profiles collecting pictures and information about you and not for social reasons.",1,False,Don't waste your time!,DenverNick1,
2015-01-27 21:27:38,I love how it doesnt longer then a hour to get a guy begging to meet me !!! I feel at home on hornet!!!:),5,False,Great gay app,Rainbowstallion,
2013-08-15 01:13:04,When it works is a 5 but now it just keeps crashing and won't let me in it needs an update so a 2 is given.,2,False,Needs update,coonkiller16,
2013-07-01 12:31:21,I like this better,5,False,What grinder should be,Otown 99,
2013-05-15 01:15:08,"This app is no better than the other ones. The only difference is it gets ""stung"" and its servers go down more frequently. Plus, I don't have ios 6, so I can't use it. Very disappointing.",1,False,Just like the others,MattBals,
2012-11-02 19:01:44,I have this app 4 stars. Would have been 5 but it crashes a lot,4,False,Ok,LeoHelios,
2013-04-12 12:43:13,Haven't been disappointed yet,5,False,This is app is pretty cool,Social wreck,
2013-04-08 08:54:35,I love it,5,False,Awesome! Everything grindr should have been.,DarkHitsugaya15,
2016-02-14 15:13:45,"Gr8 App!
Surprisingly this app is not as popular as one would think especially with Grindr going in the toilet... I've been using it for about 3yrs.
There's not much to say 
Great features all around and fairly reasonable premium pricing.

Expect the user base to expand particularly with the decline of Grindr",4,False,Excellent,Damian Lewd,
2012-10-19 00:51:55,Same as what everyone else says,5,False,Great app,Gavieno357,
2016-09-17 03:10:24,Impressed so far😜,5,False,Pretty reliable,OliviaCarey,
2015-06-29 12:44:18,Pretty good app imo. Lots of different guys which means lots of people to talk to and get to know.,5,False,Great!,Yukosukiyaki,
2015-01-10 23:37:14,My favorite app love better then grinder. Worth paying for to support,5,False,Great app,mikey630,
2014-12-28 15:48:17,Innovative and easy to navigate. You must try it!,5,False,Awesome app!,brad.lai,
2013-10-22 17:33:39,Pretty decent app better usage in bigger cities,5,False,Hornet,Rae vanity,
2013-08-26 21:58:22,"App is good but no so many active people and TOO MANY spam bots. 

You will receive annoying messages all day from spammers. I had to delete it because of it.",2,False,Spam bots all day,Ego ureña,
2015-10-06 01:54:55,"Does what it's intended to do, awesome if you're looking for a quick hook-up or some chill friends.",4,False,Great app,H41ls4t4nc4t,
2013-07-29 10:47:19,Three times I've has to create new accounts because it wouldn't let me log in to my old ones!,2,False,Accounts,Lyle Quinzell,
2013-06-28 16:19:55,Met a couple really attractive guys on here! Love it better than grindr,5,False,Love it,Ayydreean,
2013-04-23 03:17:24,Starting to like it more than grindr,5,False,:),Jj299,
2013-02-22 14:12:13,This app is great and will be better once more people sign up!,5,False,Great App,Shane489,
2013-01-04 18:58:49,Better than other social apps!,5,False,Great app!,chris8208,
2012-12-11 05:03:30,"I get lots of messages in this app but when I click the notification, the message doesn't come up. This happens daily. Also, I live near a major city but the guys on this app are so...mediocre. Jack'd is great and so is Grindr, Scruff, & GuySpy.",1,False,"Terrible, Buggy Mess",1098347138947,
2012-08-10 03:45:50,Definitely a much more accessable app for socializing.,5,False,I like it.,Skid24,
2012-03-12 04:59:42,Great app if it did't crash every minute,3,False,Keeps crashing,Felipe Ventura,
2012-02-12 15:14:19,"Works really well!  Move over Grindr, there's a new kid in town.",5,False,Awesome,LoaBenz,
2016-12-14 17:47:02,The app works well,5,False,Simple and effective,frenchinsiam,
2014-11-09 01:49:12,"It's not bad, but the layout is a little odd. I don't mind it though.",4,False,Not sure yet,AceGofHearts,
2013-09-23 01:42:43,It's awesome.. Tell the messages don't load and the guys start to ignore you completely.. Otherwise it's a great place to meet guys and chit chat,3,False,Okay!,Amazinkaykay,
2013-06-15 20:49:38,Good overall. Too bad you have to pay for some extra features,3,False,Not bad,Jeraices,
2013-09-11 20:01:40,It's okay but very slow and always says they are getting so many new users that it is unavailable. And you can't use it for hours at a time. Sense the last update will never load!,1,False,Ehh,Seth*iPhone4,
2013-08-04 10:34:12,It keeps on crashing wen u try to enter your HIV status tho,5,False,Good app!!!,D.Boy iPad,
2013-05-23 03:54:10,"So many boys so many cities to ""explore""",5,False,Addicting,Thbtchofliving,
2013-05-17 09:03:30,Like grindr and jack'd had a baby and it's name was hornet <3 amazing,5,False,Better than grindr!,Official_Carlosbran,
2013-05-08 04:56:33,Better than comparative apps,5,False,Pretty awesome thus far,Hearpm11,
2013-05-06 03:20:48,Perfect. Guys sexy(depending on location) convenient and fun!,5,False,Better than grindr and jackd,Yygfretbboog,
2013-04-14 17:14:32,"Good app, lots of hot guys. Only bad thing is Premium Membership is way too expensive and not with the money.",4,False,Good app,TBear4u69,
2013-04-15 19:42:51,"They want the highest amount of money compared to similar apps for a few premium features, yet they stay going down for various reasons",1,False,Server keeps going down,111620947,
2013-04-11 21:31:31,It's good. I like it. But they do need to fix the you got a message but you don't thing.,4,False,Rate,Randall Barnum,
2013-05-12 23:26:18,Good app! I think it's way better than the other orange looking one we all know! Lol,4,False,Decent,kaverher,
2013-01-10 22:31:49,Compared to the other social apps that are geared toward meeting friends or lovers.. this is heaven.,5,False,Near-perfect,Stawnster,
2012-02-02 03:28:21,Good app! I just wish it was set up in my area! Lol,5,False,:),tchasec95,
2016-05-24 19:15:56,"Its an average app, but its annoying how you have to pay a premium to filter your selection of men",3,False,NothingSpecial,AuthenticPastaSauce,
2015-09-02 03:58:33,Get rid of it in the profile page and on current convo page. Disruptive especially when you already have Facebook installed.,1,False,Facebook test ad,JoeVL,
2014-11-14 11:24:45,Best gay app you can find out there. Check it out!,5,False,Great,Coacci,
2014-09-30 03:51:54,App is fun. Location based shopping. But messaging system is unstable. Alerts to a new message; but nothing in Inbox etc.,3,False,Hornet Unstable,kmac_orl,
2014-09-04 01:22:10,"After this latest update, my account is wiped out. No favorites, messages, profile, etcetera. I contacted hornet support three times with no response nor remedy. Don't waste your time on this app.",1,False,Horrible after recent update,ToddMJinLA,
2014-06-09 02:56:17,"Love this app, but since the update, it crashes after a few minutes of being open. Getting very tired of it.",1,False,Keeps crashing.,Gaikkdjajks,
2014-06-03 01:52:32,Great app to get laid everyday and experience new things with guys that are unforgettable :) ^^,5,False,Omg wow every day,Well u know a strange kid,
2013-07-12 21:15:28,I don't see any issues with this app,5,False,Great app,Wassupj,
2013-05-14 14:56:51,It's def not one of my top 10 favorite apps. Every time I even think about using it it lags like crazy. It has good potential and a good design but they have to iron out all the bugs so ppl can actually enjoy it.,1,False,Very laggy,Mhdoufi,
2013-04-10 23:04:11,Pretty good app.  Similar to Grindr and such with a few extra features.,4,False,Networking & more,HowsYourCooler,
2013-04-11 12:39:43,This app is great I've met a bunch if new guys. All real great and new friends as well.,5,False,Hot,Okeealson,
2013-04-03 04:48:52,Haven't had any problems yet,4,False,Like it,Salvador Alonzo,
2013-01-12 23:22:40,"Checking it out, new to this app. So far so good, it's easy to navigate. And so far I like what I see.",4,False,\A/...,Welo 11,
2012-12-22 18:41:33,Must have!! I like that you can see more pics,4,False,Good ap,Nano8645,
2012-01-07 04:57:52,"They just need to get more people to use the app, but it's great so far!",4,False,AmaZing,Quitex,
2012-08-25 01:01:05,Oh my gosh! I can't have enough of this crap!,5,False,Simple the best,VIRTUALISIMO Carlos,
2012-06-04 20:13:09,I will def keep using,5,False,It's not to bad I actually like it,Slots Lover 916,
2012-05-06 07:36:38,Good app but needs more users,5,False,Keep it going !,Mishutkas,
2015-03-24 04:14:50,Allows u privacy but gets you out there. Really good filters and layout,4,False,Really cool app!,Denn boi,
2017-02-17 07:59:28,"I just purchased a month subscription, but it won't show on my account. When I try to restore it the app crashes. Please fix!!",1,False,Premium still not working!!,Rodolfo_Revelo,
2013-08-04 17:38:01,Location is not updated,4,False,Loc,RJAY BUENO,
2015-03-18 02:54:29,I can get great experience from this app,5,False,Great experience,Massimo MC,
2015-02-18 08:20:33,it's a really good app l can meet guys from all over the world,5,False,Love it,Angelarias19,
2014-07-04 14:01:46,Better than other chats,5,False,Great,Jgarcia909,
2014-01-04 18:59:54,The only reason why I give it 3 stars is because it works well other then that it's really boring.,3,False,It's ok,Gir8552666733674,
2013-07-19 21:02:07,Its better by far than Grindr and Jackd BECAUSE Hornet combines all of the best features of the others into one.,4,False,Best Gay Social App so far,MilitaryGuy25,
2013-07-18 10:21:04,Wish there were as many people on here as grindr (in my area),4,False,Meh,Czechkid,
2013-06-08 10:41:48,It's a bit of a better app than grindr but it kind of lags in some spots,4,False,Great app but kind of lags in spots,Time king,
2013-05-07 03:40:17,"I love using this app and meeting new guys. However, it'd be great if there was an online indicator on the chat thumbnails and a read/deliver notifier",4,False,Fun!,jayhass_,
2013-04-10 16:39:43,Easy to get hooked up.,4,False,Quite Convenient,Ye S.,
2013-04-29 18:33:57,This is a cool app that I just started using and love so far,5,False,Great so far,TheJudge15,
2013-04-18 17:41:50,"$10 monthly fee shows how greedy these people are, same as Grindr $10 month.  
 Jack'd is ONLY $2 a month and is the BEST APP  available to the Gay community. 
Jack'd's  feature and benefits are much friendlier. Over all Jack'd is the BEST APP out there!!!!!!",1,False,Charging to much!!!!!!,oflgillis,
2013-04-11 01:19:35,"I download and open the apps n it freezes two, three times. I deleted it n download again n again ! Other than that it s cooler than Grindr !",2,False,Not so good !,whattheheck1,
2012-06-11 01:33:35,App is alright overall. Not many members in my area and push notifications don't work.,2,False,A lot better Apps out there,Joshontheradio,
2014-01-13 00:50:18,"App is pretty good with nice features; just wish there were more hot guys closer to me :(
No crashes, ok pic system.",4,False,Good,Gregor Mann,
2011-11-12 21:01:05,It would be a great app if it didn't crash all the time. It definitely would beat grindr.,3,False,Promising,kale_h,
2017-06-12 18:29:56,"The app has a bizarre interface that defies reason.  For example, there is no way to unlock your private photos.",1,False,"Poor interface, lacks help function",LEAVANGELIST,
2016-01-23 12:18:27,I love it and everything here is fantastic,5,False,Wonderful App ever ❤️,DaraUth,
2015-02-02 05:17:16,Yes! You made the adds way more annoying. It was good the way it was before. I don't think anyone really likes pop-up adds. Can you please change that?,1,False,Adds? Worse?,ForrestLeviAlcatraz,
2014-11-19 23:00:23,Push notifications are awesome,5,False,Love it,Divofierce,
2014-07-06 16:33:10,So much better than grindr,5,False,The grindr killer,Chef Jared,
2014-01-20 22:11:30,"Receiving over 50 notifications a day from The Hornet Team that turn out to be nothing. My phone drives me nuts with constant notifications.
Escalated the issue and got no reply.",1,False,Lacking support for issues,josedamiani,
2013-01-04 01:23:20,Superior to grindr in all aspects except perhaps it's popularity. Just needs to catch on a bit more.,4,False,The... Bee's Knees ;),MotorMotorbike,
2013-10-14 16:57:47,"It's a fun app. Not bad, definitely improved from before. I don't use it often but it works when I try to use it. Overall I'd say it's pretty decent",2,False,It's okay,MatthewHectorPerez123,
2013-07-05 19:02:57,New to these sort of apps but this was best.,5,False,Efficient and clean.,Auroreon,
2013-04-15 06:02:06,Great application. Easy to use and user friendly. Networking sensation. I applaud you. Five (5) popcorn bags lol!!,5,False,Stung by Hornet,Marvin913,
2013-03-04 22:17:56,"Much better than grindr, arguably the best gay dating app around......this and jack'd are close race",5,False,Great app,.....shhh,
2013-02-24 00:36:11,Nice app have not had any issues yet with it run great,5,False,Great app,Magnummatt02,
2012-12-19 03:40:06,The set up is nice and you don't even need to make a account,4,False,Nice and easy,FreedomTravel,
2012-06-01 14:02:58,Good app.  Serves its purpose well.  A minor glitch or 2 but nothing major to stop my use.,4,False,Review,CABRealness,
2012-05-15 01:20:27,Love this app !!! ... feature friendly ... will surpass Grindr when more guys get the venom !!!,5,False,Hornet Stings !!!!!,gene-o,
2014-11-11 05:05:56,"Guys working hard, so i like how it goes",5,False,Going good,Tecugaku,
2015-08-31 12:43:02,"Nothing special.  I guess if you are into thinks or African Americans, this is the app for you.  Other than that, don't waste the space on your device.",1,False,Just like all the other social media apps,Avgguyinnc,
2014-09-03 02:35:21,"This last update got rid of my account. The only option in settings is to create a new account, there is no apparent way to sign in to an account you already have.",1,False,DO NOT UPDATE!,Quicksilver324,
2014-07-22 18:29:08,"This is a great app to use, much better than grindr. Highly recommended.",4,False,Awesome,Jon_S21,
2014-09-03 01:34:15,When I try and download it it says it's not available anymore.???? Uhh why.??,3,False,Not Available anymore.?,GavinoDelRey,
2014-07-24 01:54:24,Ale to use this application then other chat rooms,5,False,Great app,Danny Boi5,
2014-01-18 07:20:28,Who Viewed You on non-membership,4,False,Should have,jrpx14,
2013-04-05 23:56:51,I'll give it 4 stars for now. Lets see how it is over some time.,4,False,So far so good,tjacobs0100,
2013-07-11 19:37:17,Love this app hope it beats Grindr this year,5,False,Awesome better than Grindr,Stondevryware,
2013-04-28 19:05:55,I found my boyfriend there he is so cute that why I love this app,5,False,Cool app,Tanner raya,
2013-04-27 05:31:35,This is the best of the apps on the App Store currently. Highly recommended.,5,False,Best yet,Ian Karlin,
2013-04-20 04:29:27,"Why I can not see the location ( City, town or neighborhood) in the guy's profiles? I only see how long in miles they are from me but it's not very useful.",2,False,Mmm....,SUPERMADONNICO,
2013-02-07 20:43:04,This app works better than most others. That's good enough for me.,4,False,Awesome,JessieSRQ,
2013-03-27 08:15:06,"I totally love the app...in fact it is much better than Grindr, Scruff, Distinct or Jack'd.....gay gay gay gay gay paradise! Who is up for a gay chat? :-)",5,False,The best gay chat and dating free app out there,Vladoun,
2013-05-30 02:51:39,"My favorite gay app, but because it's new it has issues.",4,False,Great! But glitchy,[E_Z],
2012-09-24 20:43:57,Super awesome better then most apps I seen.,5,False,Rating,Lucky#27,
2012-08-14 00:07:50,The best gay social network app out there. Leaves all others in the dust. :),5,False,A++,Clgclgclgclg,
2012-08-12 18:27:04,So much better than Grindr.,5,False,Uber Spectacular App,MajesticGiggles,
2012-08-06 16:54:04,Worked once for me. Went through all the trouble of creating an account and now it says their servers are down every time I launch the app.,1,False,Doesn't connect,osric courtier,
2012-05-03 23:03:50,"Fully featured! 
Just wish more guys were on it.",5,False,Best yet!,MJtheRam,
2012-03-15 03:09:59,Not even in new york city is there any activity on this app.  The app adds travelers not close to your area to increase the profiles near you.,2,False,Hello! Is anyone there?,Rei$er,
2011-12-16 18:07:56,App works really good!:) what the buck show was right!:),5,False,Buck sent me!!!:),redipad333,
2017-02-15 08:43:49,It keeps crashing,3,False,Crashing,Ayel123,
